,Title,URL,Album,InAnAlbum,Lyrics
62,I Found Love,https://genius.com/Owl-city-i-found-love-lyrics,Mobile Orchestra,True,"I was so young and reckless
It was all a blur but there you were
And your love left me breathless
When the fairy dust fell over us
Yeah I, I felt like I could fly
Cause I, I found love
So take my hand, and shed a tear
Before I'm gone, it's now or never
I'll hold you close, the end is near
But love goes on and on forever
It's so dark in my mind
I cross my heart and hope to die
I'm so bad, at goodbyes
I hold my breath, and close my eyes
I don't have a lot left
Oh, how did it end so fast?
I say, with my last breath
It's a perfect day, to float away
When the sparks, flew between us
I saw you glow, and had to know
Where our journey would lead us
'Til the story end, and back again
Yeah I, I felt like I could fly
Cause I, I found love
So lead me home, and lift me up
Above the stars, and even higher
I'm not afraid, because your love
It falls like rain, and burns like fire
It's so dark in my mind
I cross my heart and hope to die
I'm so bad, at goodbyes
I hold my breath, and close my eyes
I don't have a lot left
Oh, how did it end so fast?
I say, with my last breath
It's a perfect day to float away
I'll love you forever
And you were my dream come true
I say, with my last breath
It's a perfect day to float away
Yeah I, I felt like I could fly
Cause I, I found love"
63,I Hope You Think of Me,https://genius.com/Owl-city-i-hope-you-think-of-me-lyrics,The Midsummer Station,True,"She wound a thread around the pieces of my broken heart
And left me to believe
That girls don't want to, girls don't want to leave
A starry night without a fear of heights
I can't recall, Because I learned after all
That girls don't want to, girls don't want to fall
As you doze off tonight, I'll toss and turn
As your sweet dreams take flight, I'll crash and burn
While your heart flutters free, I still can't breathe
As you stir in your sleep, I hope you think of me
Da da da da da da daaaaa
Da da da da da da daaaaa 
I miss the way she whispered in my ear
Before she left, had me so convinced
That girls don't want to, girls don't want to leave
And Juliet's romantic balcony
Wears out the wall, but I learned after all
That girls don't want to, girls don't want to fall
As you doze off tonight, I'll toss and turn
As your sweet dreams take flight, I'll crash and burn
While your heart flutters free, I still can't breathe
As you stir in your sleep, I hope you think of me
When you're alone
I hope my ghost never leaves
Because when I'm home
Your painful memory is always haunting me
As you doze off tonight, I'll toss and turn
As your sweet dreams take flight, I'll crash and burn
While your heart flutters free, I still can't breathe
As you stir in your sleep, the thought is killing me
When I see you around, my eyes go wide
When you race through my mind, I die inside
While your heart flutters free, I still can't breathe
As you stir in your sleep, I hope you think of me
 
Da da da da da da daaaaa
I hope you think of me"
65,I’m Coming After You,https://genius.com/Owl-city-im-coming-after-you-lyrics,The Midsummer Station,True,"I saw your face in a criminal sketch
Don't be alarmed 'cause you don't know me yet
I'm on the prowl now sniffing around this town, for you
Calling all cars there's an officer down
Shot to the heart on a night on the town
And the evidence of your fingerprints was found and now
You got the right to remain right here with me
I'm on your tail in a hot pursuit
Love is a high-speed chase racing down the street
I'm coming after you
I'm coming after you
I'm coming after you
Oh, no here we go once again
We both know you'll never turn yourself in
So I'm driving till it's light out
Searching for your hide-out
(Driving till it's light out
Searching for your hide-out)
Pick up the pace as I chase you around
One of these days I'll end up tracking you down
But, yeah, I got the feeling I'll be letting you loose when I do 
You got the right to remain right here with me
I'm on your tail in a hot pursuit
Love is a high-speed chase racing down the street
I'm coming after you
You got the right to remain right here with me
I'm on your tail in a hot pursuit
Love is a high-speed chase racing down the street
I'm coming after you
I'm coming after you
I'm coming after you
I'm coming after you
I'm coming after you
Love is a high-speed chase racing down the street
You got the right to remain right here with me
I'm on your tail in a hot pursuit
Love is a high-speed chase racing down the street
I'm coming after you
I'm coming after you
I'm coming after you
I'm coming after you
I'm coming after you
I'm coming after you
I'm coming after you 
I'm coming after you
I'm coming after you "
76,Meteor Shower,https://genius.com/Owl-city-meteor-shower-lyrics,Ocean Eyes,True,"I can finally see that you're right there beside me
I am not my own, for I have been made new
Please don't let me go, I desperately need you
I am not my own, for I have been made new
Please don't let me go, I desperately need you"
77,Metropolis,https://genius.com/Owl-city-metropolis-lyrics,The Midsummer Station,True,"Oh oh, I can't even take it in
Oh oh, I can't even take it in
Oh oh, I left my heart in Metropolis
So far apart, I check that the coast was clear
I feel like a postcard, I wish you were here
Subway through the dark, carriage through the park
Taxi down the street, get out and use my feet
Don't matter much to me what it is that I do
As long as I'm coming home with you
Oh oh oh, as far as I can see
You're the only one, the only one who can get to me
Like a hijacked plane, or a runaway train
Or a speeding bullet, there's no stopping this
I left my heart in Metropolis
A thousand miles feels like a million years
Like hundreds of postcards that say I wish you were here
Airplane through the sky, greyhound racing by
Dirt bike on the beach, sailboat on the sea
Don't matter much to me what it is that I do
As long as I'm coming home with you
I left my heart in Metropolis!
Like a hijacked plane, or a runaway train
Or a speeding bullet, there's no stopping me!
I left my heart in Metropolis!
I left my heart in Metropolis!
I left my heart in Metropolis!
I left my heart in Metropolis!
Oh oh, I can't even take it in
Oh oh, I can't even take it in
Oh oh, I can't even take it in
Oh oh, I left my heart in Metropolis"
80,My Everything,https://genius.com/Owl-city-my-everything-lyrics,Mobile Orchestra,True,"When my hope is lost and my strength is gone
I run to You, and You alone
When I can't get up, and I can't go on
I run to You, and You alone
Cause You're my light in the dark
And I sing with all of my heart
Hallelujah, my almighty God divine
Hallelujah, I am Your's and You are mine
This is all I know how to say
Hallelujah, Hallelujah
You're my everything
When I'm plagued with pain, and filled with fear
I run to You, and You alone
When my days are few, and death is near
I run to You, and You alone
Cause You're my light in the dark
And I sing with all of my heart
Hallelujah, my almighty God divine
Hallelujah, I am Your's and You are mine
This is all I know how to say
Hallelujah, hallelujah
When trouble comes and goes
And when the cold wind blows
I lift my hands up
I lift my hands up
When sorrow knocks me down
And you pick me off the ground
I lift my hands up
I lift my hands up
And I sing …
Hallelujah, my almighty God divine
Hallelujah, I am Your's and You are mine
This is all I know how to say
Hallelujah, by the grace of God above
Hallelujah, I'll shine a light cause I am loved
This is all I know how to say
Hallelujah, hallelujah
This is all I know how to say
Hallelujah, Hallelujah
You're my everything
Oh-oh, You're my everything"
90,Rugs From Me To You,https://genius.com/Owl-city-rugs-from-me-to-you-lyrics,Ocean Eyes,True,"Toupee or not toupee
That is the question
It refused to stay as it all turned grey
William Shakespeare's receding hair
Please excuse the pun
'It's hair today, gone tomorrow'
So I'll be thankful
For what precious locks you have
Toupee or not toupee
That is the question
And by the way I just got to say
Thank the Lord I'm not going bald
And if I may quip
My curls and I
Are just like heaven
'Cause rest assured
There'll be no parting there
But should my head get bare like Friar Tuck
It makes me smile
'Cause I know just what I'd do
Yeah if I had more wigs than I knew what to do with
I'd open a second hand store
And if you ever went bald
You'd recall it
'Cause I'd cleverly call it
""Rugs From Me To You"""
91,Shooting Star,https://genius.com/Owl-city-shooting-star-lyrics,The Midsummer Station,True,"Close your tired eyes, relax and then
Count from 1 to 10 and open them
All these heavy thoughts will try to weigh you down, but not this time
Way up in the air, you're finally free
And you can stay up there, right next to me
All this gravity will try to pull you down, but not this time
When the sun goes down, and the lights burn out
Then it's time for you to shine
Brighter than a shooting star, so shine no matter where you are
Fill the darkest night, with a brilliant light
'Cause it's time for you to shine
Brighter than a shooting star, so shine no matter where you are tonight
Woah, woah, woah
Brighter than a shooting star
Shine no matter where you are, tonight
Gaze into my eyes, when the fire starts
And fan the flame so hot, it melt our hearts
All the pouring rain, will try to put it out, but not this time
Let your colors burn, and brightly burst
Into a million sparks that all disperse
And illuminate a world that'll try to bring you down, but not this time
When the sun goes down, and the lights burn out
Then it's time for you to shine
Brighter than a shooting star, so shine no matter where you are
Fill the darkest night, with a brilliant light
'Cause it's time for you to shine
Brighter than a shooting star, so shine no matter where you are tonight
Woah, woah, woah
Brighter than a shooting star
Shine no matter where you are, tonight
A thousand heartbeats beat in time
And makes this dark planet come alive
So when the lights flicker out tonight, you gotta shine
When the sun goes down, and the lights burn out
Then it's time for you to shine
Brighter than a shooting star, so shine no matter where you are
Fill the darkest night, with a brilliant light
'Cause it's time for you to shine
Brighter than a shooting star, so shine no matter where you are tonight
Woah, woah, woah
Brighter than a shooting star
Shine no matter where you are, tonight"
95,Silhouette,https://genius.com/Owl-city-silhouette-lyrics,The Midsummer Station,True,"I'm tired of waking up in tears
'cause I can't put to bed these phobias and fears
I'm new to this grief I can't explain
But I'm no stranger to the heartache and the pain
The fire I began, is burning me alive
But I know better than to leave and let it die
I'm a Silhouette asking every now and then
Is it over yet? Will I ever feel again?
I'm a Silhouette chasing rainbows on my own
But the more I try to move on the more I feel alone
So I watch the summer stars to lead me home
I'm sick of the past I can't erase
A jumble of footprints and hasty steps I can't retrace
The mountain of things that I still regret
Is a vile reminder that I would rather just forget
The fire I began, is burning me alive
But I know better than to leave and let it die
I'm a Silhouette asking every now and then
Is it over yet? Will I ever smile again?
I'm a Silhouette chasing rainbows on my own
But the more I try to move on the more I feel alone
So I watch the summer stars to lead me home
'cause I walk alone
No matter where I go
'cause I walk alone
No matter where I go
'cause I walk alone
No matter where I go
I'm a Silhouette asking every now and then 
Is it over yet? Will I ever love again? 
I'm a Silhouette chasing rainbows on my own
But the more I try to move on the more I feel alone
So I watch the summer stars to lead me home
I watch the summer stars to lead me home"
97,Speed of Love,https://genius.com/Owl-city-speed-of-love-lyrics,The Midsummer Station,True,"I tried to disappear
But you're the only reason I'm floating here
Eyes painted crystal clear
I can see our future through the atmosphere
Don't you go, no, don't you go
Don't you know I'm up here alone
Yeah, I am like a satellite
Sending you a signal tonight
Oh, oh, oh like a streak of light
Oh, oh, oh watch the world fly by
Oh, oh, oh rev your engine up
Everybody's racing at the speed of love
You were so hard to find
With oh, so many clouds across my summer sky
You, my constellation prize
Yeah, every single star is sparkling in your eyes
So, don't you go, no, don't you go
Because don't you know I'm up here alone
Yeah, so high, like a satellite
I'm sending you a signal tonight
Oh, oh, oh like a streak of light
Oh, oh, oh watch the world fly by
Oh, oh, oh rev your engine up
Everybody's racing at the speed of love
Oh, oh, oh like a streak of light
Oh, oh, oh watch the world fly by
Oh, oh, oh rev your engine up
Everybody's racing at the speed of love
One track, one mind, one race to win
One start, one heart, one life to live
One track, one mind, one race to win
One start, one heart, one life to live
Oh, oh, oh like a streak of light
Oh, oh, oh watch the world fly by
Oh, oh, oh rev your engine up
Everybody's racing at the speed of love
Oh, oh, oh like a streak of light
Oh, oh, oh watch the world fly by
Oh, oh, oh rev your engine up
Everybody's racing at the speed of love"
98,Strawberry Avalanche,https://genius.com/Owl-city-strawberry-avalanche-lyrics,Ocean Eyes,True,"This is a world of dreams and reverie
Where I felt the stars explode around me
A grass blade flashed with a gleam
As it slashed open a moonbeam
And I stared back breathlessly
As mountains of fruit tumbled out
I barely had the chance to shout
""Oh strawberry avalanche, crash over me!""
Staying awake that night was rather hard
Deep in a sleeping bag in your back yard
When we woke up buried alive
Beneath the fruity landslide
We both laughed hysterically
It could've been just another dream
But I swear I heard you scream
""Oh strawberry avalanche, crash over me!""
Hope is a citrus constellation in the galaxy
Scratched on the back of both my eyelids
That I've been dying to see 
If you were a beautiful sound in the echoes all around
Then I'd be your harmony
And we'd sing along with the crowds
Beneath the candy coated clouds
""Oh strawberry avalanche, please crash over me.""
This is a world of dreams and reverie
Where I felt the stars explode around me"
99,Sunburn,https://genius.com/Owl-city-sunburn-lyrics,Ocean Eyes,True,"So there we were, back home from somewhere inside my head
Oh, bravely I fought off the monsters beneath her bed
Pillars of postwar books supported my frame of mind
While she memorized the pages that I tried to not hide
Behind
She took my hand in hers and whispered her love for me
The lantern died that night but we didn't need to see
Implying that she's the bee's knees and I am the cat's meow
It's funny how she recalls what I can't remember now
But when her smile came back
And I didn't feel half as horrible
She gave me a heart attack
Just because she looked so adorable
We both put our sunblock on
Played on the beach and vowed
That we'd live and we'd learn
Yeah, but she got a tan and
I got a sunburn
I got a sunburn
So there we were out there, unaware of where we'd been
We kicked off our flip-flops and swung from the rooftops again
It's awkward but I'll confess she's all I can think about
And it's funny how I recall what she can't remember now
But when her smile came back
And I didn't feel half as horrible
She gave me a heart attack
Just because she looked so adorable
We both put our sunblock on
Played on the beach and vowed
That we'd live and we'd learn
Yeah, but she got a tan and
I got a sunburn
Oh, afterglow, look out below
We left a trail of dust behind
As we parted ways, she held my gaze
And left an imprint on my mind
I tried not to cry as we said goodbye
And hung the clouds above my town
But I shed a tear when she disappeared
'Cause now I'm a stranger on the ground
(When her smile came back
And I didn't feel half as horrible
She gave me a heart attack)
We both put our sunblock on
Played on the beach and vowed
That we'd live and we'd learn
But she got a tan and I got a sunburn
She got a tan and I got a sunburn
Yeah, but she got a tan and I got a sunburn"
102,Take It All Away,https://genius.com/Owl-city-take-it-all-away-lyrics,The Midsummer Station,True,"There was a shot in the dark
I was caught by surprise
There was a hole in my heart
There were tears in your eyes
And there was nothing to say
Because you made up your mind
And so I guess what you meant
When you left was goodbye
So if you're going to go
And leave me in a lonely gray
I won't let it show
Until you finally flown away
You got to know that you tear me up
When you say you want to take it all away, take it all away
You tear me up when you say
You want to take it all away, take it all away!
You were the one, and it was enough
To be the one you were dreaming of!
You were the one and we called it love
And now you take it away, take away!
I felt a pain in my chest with your kiss on my cheek
And as I tried to digest the words I couldn't believe
I'm left with nothing to say with my heart on my sleeve
Making it easy to hurt, and even harder to breathe
So if you're going to go
And leave me in a lonely gray
I won't let it show
Until you finally flown away
You got to know that you tear me up
When you say you want to take it all away, take it all away
You tear me up when you say
You want to take it all away, take it all away!
You were the one, and it was enough
To be the one you were dreaming of!
You were the one and we called it love
And now you take it away, take away!
You take it all away
You take it all away
You take it all away
You got to know that you tear me up
When you say you want to take it all away, take it all away
You tear me up when you say
You want to take it all away, take it all away!
You were the one, and it was enough
To be the one you were dreaming of!
You were the one and we called it love
And now you take it away, take away!"
105,The Bird And The Worm,https://genius.com/Owl-city-the-bird-and-the-worm-lyrics,Ocean Eyes,True,"If you're the bird
Whenever we pretend it's summer
Then I'm the worm
I know the part, it's such a bummer
But fair is fair
If my segments get separated
I'll scream
And you'll be there
Close your eyes
Slide the cotton off of your shoulder
And feel the shine
I'm hooked so toss me over
And cast the line
I'll throw a party and greet my undersea friends
As they arrive
You and I left our troubles far behind
But I still have just one more question on my mind
For all my pals who live in the oceans and the seas
With friends like these, well
Who needs enemies?
If I'm your boy
Let's take a shortcut we remember
And we'll enjoy
Picking apples in late September like
We've done for years
Then we'll take a long walk
Through the cornfield
And I'll kiss you
Between the ears
If you're my girl
Swirl me around your room with feeling
And as we twirl
The glow in the dark stars on your ceiling
Will shine for us
As love sweeps over the room
Because we tend to make
Each other blush
You and I left our troubles far behind
But I still have just one more question on my mind
For all my pals who live in the oceans and the seas
With fronds like these, well
Who needs anemones?
You're the bird, I'm the worm
And it's plain to see
That we were meant to be
We were meant to be
We were meant to be
If you're the bird
If you're the bird
Then I'm the worm
We were meant to be"
111,The Tip Of The Iceberg,https://genius.com/Owl-city-the-tip-of-the-iceberg-lyrics,Ocean Eyes,True,"Welcome back
Winter once again
And put on your warm fuzzy sweater
Because you'll feel much better when
The snowflakes fall
Gently to the ground
The temperature drops
And your shivers freeze all the rivers around
But I keep you warm
If speed's a pro
Inertia must be a con
Because the cold wind blows at precise rates
When I've got my ice skates on
If all the roads
Were paved with ice that wouldn't thaw or crack
I could skate from Maine to Nebraska
Then on to Alaska and back
Because you keep me warm
Peer over the edge
Can you see me?
Rivulets flow from your eyes
Paint runs from your mouth
Like a waterfall
And your lungs crystalize
I'll travel the sub-zero tundra
I'll brave glaciers and frozen lakes
And that's just the tip of the iceberg
I'll do whatever it takes
To change
Farewell powdery paradise
We'd rather skate on the thinnest ice
Fingers failed us before they froze
Frostbite bit down on all our toes
Snow drifts build up and enfold us
As we wait out this winter storm
So we snuggle close in the darkness
And keep each other so warm"
113,This Isn’t the End,https://genius.com/Owl-city-this-isnt-the-end-lyrics,Mobile Orchestra,True,"An 8 year old girl had a panic attack
Cause the father she loved left and never looked back
No longer the hero, she counted on
He told her he loved her and then he was gone
She tried to look happy in front of her friends
But knew that she'd never feel normal again
She fought back the tears as they filled her eyes
And wanted him back just to tell him goodbye
When the rain falls down
When it all turns around
When the light goes out this isn't the end
Her dad was a good guy that everyone liked
But nobody knew he was dying inside
He promised his family he'd be all right
And then with a gunshot he left them behind
When the rain falls down
When it all turns around
When the light goes out this isn't the end
When the rain falls down
When it all turns around
When the light goes out this isn't the end
The role of a father, he never deserved
He abandoned his daughter and never returned
And over the years though the pain was real
She finally forgave him, and started to heal
How close is the ending? Well, nobody knows
The future's a mystery and anything goes
Love is confusing and life is hard
You fight to survive cause you made it this far
It's all too astounding to comprehend
It's just the beginning this isn't the end
It's just the beginning this isn't the end"
115,Thunderstruck,https://genius.com/Owl-city-thunderstruck-lyrics,Mobile Orchestra,True,"I feel you glowing in the dark
When I collapse into your arms
I'm just a stranger in the stars
Cause somehow it seems when I am with you
That all of my dreams begin to come true
And carefully you carry me away
I've never felt so wide awake
Cause I'm wonder struck
I love how you take my breath away
I'm thunderstruck
To tell you the truth, I'm so afraid
That I'm out of luck
I love how you take my breath away
I'm thunderstruck
Ahhaha hah yeah ahhaha hah yeah
I chase the phantoms down the hall
I felt the floorboards rise and fall
I lost and never loved at all
I find in the days when you're in my dreams
The orchestra plays the prettiest themes
And carefully you carry me away
I've never felt so wide awake
Cause I'm wonder struck
I love how you take my breath away
I'm thunderstruck
To tell you the truth, I'm so afraid
That I'm out of luck
I love how you take my breath away
I'm thunderstruck
 together]
Woah, I'm leaving the world behind
(All of my dreams
Oh, and my dreams are shattered)
Woah, I'm over the moon tonight
(All of my dreams
Oh, and my dreams are shattered)
Cause somehow it seems 
That all of my dreams 
And carefully you carry me away
]
You take my breathe away
When I'm with you
All of my dreams
And my dreams are shattered
My dreams are shattered"
116,Tidal Wave,https://genius.com/Owl-city-tidal-wave-lyrics,Ocean Eyes,True,"I wish I could cross my arms, and cross your mind
'Cause I believe you'd unfold your paper heart and wear it on your sleeve
All my life I wish I broke mirrors, instead of promises
'Cause all I see, is a shattered conscience staring right back at me
I wish I had covered all my tracks completely 'cause I'm so afraid
Is that the light at the far end of the tunnel or just the train?
Lift your arms only heaven knows, where the danger grows
And it's safe to say there's a bright light up ahead and
Help is on the way
Help is on the way
Help is on the way
Help is on the way
Help is on the way
I forget the last time I felt brave, I just recall insecurity
'Cause it came down like a tidal wave, and sorrow swept over me
Depression, please cut to the chase and cut a long story short
Oh please be done. How much longer can this drama afford to run?
Fate looks sharp, severs all my ties and breaks whatever doesn't bend. But sadly then, all my heavy hopes just pull me back down again
Back down again, back down again, back down again, back down again, back down again, back down again, back down again
I forget the last time I felt brave, I just recall insecurity
'Cause it came down like a tidal wave, and sorrow swept over me
Then I was given grace and love, I was blind but now I can see
'Cause I found a new hope from above, and courage swept over me
It hurts just to wake up, whenever you're wearing thin
Alone on the outside, so tired of looking in
The end is uncertain and I've never been so afraid
But I don't need a telescope to see that there's hope
And that makes me feel brave"
