,Title,URL,Album,InAnAlbum,Lyrics
118,Top of the World,https://genius.com/Owl-city-top-of-the-world-lyrics,The Midsummer Station,True,"It's my time, and right now, I'm going for it
It's my turn to take on the world
And right now, the sky is my only limit
Yeah, I'm ready to take on the world
It's my time, and right now, I'm moving forward
It's my turn to reach for the stars
And right now, it's cold, but I'm getting warmer
It's my turn to live on the edge
It's high time like dark days without an order
Yeah, I'm ready to take on the world
Oh, I'm a satellite
Because I'm over the moon tonight
Oh, feeling so alive
Cause I'm on top of the world tonight
Whoa-oh-oh-oh-oh-oh
I'm on top of the world tonight
Whoa-oh-oh-oh-oh-oh
I'm on top of the world tonight
Oh, feeling so alive
Cause I'm on top of the world tonight
It's my time to burn like a wildfire
It's my turn to rise to the top
I'm so stoked, with flames keep on getting higher
And I'm ready to take on the world
It's my time, and right now, I'm going for it
Yeah, I'm ready to take on the world
Oh, I'm a satellite
Because I'm over the moon tonight
Oh, feeling so alive
Cause I'm on top of the world tonight
Whoa-oh-oh-oh-oh-oh
I'm on top of the world tonight
Whoa-oh-oh-oh-oh-oh
I'm on top of the world tonight
Oh, feeling so alive
Cause I'm on top of the world tonight
Whoa-oh-oh-oh-oh-oh
I'm on top of the world tonight
Whoa-oh-oh-oh-oh-oh
I'm on top of the world tonight
Whoa-oh-oh-oh-oh-oh
I'm on top of the world tonight
Whoa-oh-oh-oh-oh-oh
I'm on top of the world tonight
Oh, I'm a satellite
Because I'm over the moon tonight
Oh, feeling so alive
Cause I'm on top of the world tonight
Whoa-oh-oh-oh-oh-oh
I'm on top of the world tonight
Whoa-oh-oh-oh-oh-oh
I'm on top of the world tonight
Oh, feeling so alive
Cause I'm on top of the world tonight
Whoa-oh-oh-oh-oh-oh
I'm on top of the world tonight
Whoa-oh-oh-oh-oh-oh
I'm on top of the world tonight
Whoa-oh-oh-oh-oh-oh
I'm on top of the world tonight
Whoa-oh-oh-oh-oh-oh
I'm on top of the world tonight"
120,Umbrella Beach,https://genius.com/Owl-city-umbrella-beach-lyrics,Ocean Eyes,True,"Stems and gears, oh how the daisies bloom
When chandeliers light up the engine room
Can you feel the drops as it starts to rain?
There's an underwater Ferris wheel
Where I found the missing link to this island chain
Home will always be here, unseen; out of sight
Where I disappear and hide
I think dreamy things as I'm waving goodbye
So I'll spread out my wings and fly
Home is a boxcar and it's so far out of reach
Hidden under umbrella beach
Home will always be here, unseen; out of sight
Where I disappear and hide
I think dreamy things as I'm waving goodbye
So I'll spread out my wings and fly
Home is a boxcar and it's so far out of reach
Hidden under umbrella beach"
121,Unbelievable,https://genius.com/Owl-city-unbelievable-lyrics,Mobile Orchestra,True,"It's unbelievable
This is as good as it gets
It's unbelievable
Don't know what's gonna happen next
It's unbelievable
You haven't seen nothing yet
It's unbelievable, it's unbelievable
When I was a kid I saved up all my dough so I could buy C-3PO
Put Mentos in my Diet Coke in the backseat of the bus
When I was a kid I ate ""Spaghetti Os"", played laser tag and GI Joe's
And if you vowed no girls allowed then you could join the club
When I was I was a kid I spent my Saturday's
Blowin' on Nintendo games
The newest thing was Lion King and I could feel the love
It's unbelievable
This is as good as it gets
It's unbelievable
Don't know what's gonna happen next
It's unbelievable
You haven't seen nothing yet
It's unbelievable, it's unbelievable
When I was a kid I dreamed of Power Wheels
Stayed up late watching action films
And I won't lie, my friends and I, were too legit to quit
When I was a kid I lived for climbing trees and Dr Pepper jellybeans
My favorite part of ""Jurassic Park"" was how real the Raptors looked
When I was a kid I still had VHS, watched Fresh Prince and Jazzy Jeff, Zack Morris owned the first cell phone, it was off the hook!
It's unbelievable
This is as good as it gets
It's unbelievable
Don't know what's gonna happen next
It's unbelievable
You haven't seen nothing yet
It's unbelievable, it's unbelievable
Gak, pogs, and floam and Home Alone, Berenstein bears and bean bag chairs
My L.A. Looks and Goosebumps books, oh Etch-a-sketch
What happens next?
Grape juicy juice and Dr. Seuss, piggy-back rides and
Slip-n-slides, McDonalds Fries, those were the best
What happens next?
It's unbelievable
This is as good as it gets
It's unbelievable
Don't know what's gonna happen next
It's unbelievable
You haven't seen nothing yet
It's unbelievable, those were the days oh-oh
It’s unbelievable
When I think back on my name
It’s unbelievable
Cause baby those were the days
It’s unbelievable
It ruled in so many ways
It’s unbelievable, it’s unbelievable"
123,Vanilla Twilight,https://genius.com/Owl-city-vanilla-twilight-lyrics,Ocean Eyes,True,"The stars lean down to kiss you
And I lie awake and miss you
Pour me a heavy dose of atmosphere
'Cause I'll doze off safe and soundly
But I'll miss your arms around me
I'd send a postcard to you dear
'Cause I wish you were here
I'll watch the night turn light blue
But it's not the same without you
Because it takes two to whisper quietly
The silence isn't so bad
'Til I look at my hands and feel sad
'Cause the spaces between my fingers are
Right where yours fit perfectly
I'll find repose in new ways
Though I haven't slept in two days
'Cause cold nostalgia chills me to the bone
But drenched in vanilla twilight
I'll sit on the front porch all night
Waist-deep in thought because when I think of you
I don't feel so alone
I don't feel so alone
I don't feel so alone
As many times as I blink, I'll think of you tonight
I'll think of you tonight
When violet eyes get brighter
And heavy wings grow lighter
I'll taste the sky and feel alive again
And I'll forget the world that I knew
But I swear I won't forget you
Oh, if my voice could reach back through the past
I'd whisper in your ear
""Oh darling, I wish you were here"""
124,Verge,https://genius.com/Owl-city-verge-lyrics,Mobile Orchestra,True,"Ain't too sure what I believe in
I believe in what I see
And when I close my eyes
I see my whole life ahead of me
These are our hours
This is our time 
These are our hours
Out on the verge
Out on the verge of the rest of our lives
Out on the verge of the rest of our lives tonight
Top of the world and we're dressed to the nines tonight
Edge of the Earth and we're touching the sky tonight
Out on the verge of the rest of our lives
These are our hours
This is our time
These are our hours
Out on the verge
Out on the verge of the rest of our lives
Out on the verge of the rest of our lives tonight
Top of the world and we're dressed to the nines tonight
Edge of the Earth and we're touching the sky tonight
Out on the verge of the rest of our lives
From now on, there’s no looking back
Full-steam ahead on this one-way track
From this day forth, I will make a promise
To be true to myself and always be honest
For the rest of my life
I will do what’s right
I will do what’s right
When I'm step out on the verge
Out on the verge of the rest of our lives tonight
Top of the world and we're dressed to the nines tonight
Edge of the Earth and we're touching the sky tonight
Out on the verge of the rest of our lives
Edge of the Earth and we’re touching the sky tonight
Out on the verge of the rest of our lives"
133,You’re Not Alone,https://genius.com/Owl-city-youre-not-alone-lyrics,Mobile Orchestra,True,"Some days I barely hold on
When life drags me down
I wanna let go
But when my spirit is weak
You come to my aid
And strengthen my soul
I'm lost without You
I'll never doubt You
Your grace is beyond compare
And though when it rains, it pours
You know all I have is Yours
You smile when You hear my prayer
You rescued me, and I believe
That God is love, and He is all I need
From this day forth, for all eternity
I'll never wander on my own
For I am yours until you call me home
I close my eyes, and I can hear you say
“You're not alone”, oh oh-oh
“You're not alone”, oh oh-oh
Some days I just can't go on
I stumble and fall
And I hang my head
But you reach out for my hand
And You lift me up
Again and again
Oh, yes you do
In the face of my depravity
For God so loved the world, He died for me, yeah
My fire burns, ‘till He returns
And takes me home beyond the galaxy
You're not, you're not alone
Never alone …"
