,Title,URL,Album,InAnAlbum,Lyrics
9,Back Home,https://genius.com/Owl-city-back-home-lyrics,Mobile Orchestra,True,"I'm saying goodbye to the skyline
Hello to the sweet pines
Gonna see you later street lights
I'm headed back to tree lines
To free time and starry nights
To bonfires and fireflies
Pack your bags it's time to go
Cause we got brighter lights back home
I've got aching feet
From walking over miles of concrete
And I can't wait to dream
But the city, you know she won't go to sleep
So I'm saying...
Goodbye to the skyline
Hello to the sweet pines
Gonna see you later street lights
I'm headed back to tree lines
To free time and starry nights
To bonfires and fireflies
Pack your bags it's time to go
Cause we got brighter lights back home
Yeah, we got brighter lights back home
Back home there's a girl named Mary Lou
A diner off the highway with a corner booth
And every gravel road is a trip down memory lane
And back home, where the corn grows ten feet tall
Every year's measured on the pantry wall
The willow trees are waving 'til we come back home again
]
I'm saying goodbye to the skyline
Hello to the sweet pines
Gonna see you later street lights
I'm headed back to tree lines
(To free time and starry nights
To bonfires and fireflies
Pack your bags it's time to go)
Pack your bags it's time to go
 Together]
I'm saying goodbye to the skyline
Hello to the sweet pines
Gonna see you later street lights
I'm headed back to tree lines
To free time and starry nights
Pack your bags it's time to go
Pack your bags it's time to go"
14,Bird with a Broken Wing,https://genius.com/Owl-city-bird-with-a-broken-wing-lyrics,Mobile Orchestra,True,"So I walk alone down the darkest roads
Cause I've always known how the story goes
When the curtain falls I'll be wearing thin
Clawing at the walls as they're closing in
In this twisted plot I was destined for
I'm an astronaut on the ocean floor
So misunderstood 'till the bloody end
How I wish I could do it all again
It feels like I'm a lone survivor
Forgotten in a dark and deadly world
And on my own I walk alone
To see the sun again I'd give anything
But life demands a final chapter
A story that we all must leave behind
It's do or die, and this is mine
The anthem of a bird with a broken wing
It's another night of the living dead
Like a viper bite in a spiderweb
It's so deathly dark in the alleyway
And a bleeding heart makes you easy prey
I would run and hide for the afternoon
With the butterfly in the panic room
Though I won't be missed, I would say it's time
For a different twist in the story line
It feels like I'm a lone survivor
Forgotten in a dark and deadly world
And on my own I walk alone
To see the sun again I'd give anything
But life demands a final chapter
A story that we all must leave behind
It's do or die, and this is mine
The anthem of a bird with a broken wing
The anthem of a bird with a broken wing
It feels like I'm a lone survivor
Forgotten in a dark and deadly world
And on my own I walk alone
To see the sun again I'd give anything
But life demands a final chapter
A story that we all must leave behind
It's do or die, and this is mine
The anthem of a bird with a broken wing
The anthem of a bird with a broken wing
The anthem of a bird with a broken wing
Tell the world I know that my mind is made
It's a horror show, but I'm not afraid
Though I won't be missed, I would say it's time
For a different twist in the story line"
15,Bombshell Blonde,https://genius.com/Owl-city-bombshell-blonde-lyrics,The Midsummer Station,True,"That blonde, she's a bomb, she's an atom bomb
Rigged up, and ready to drop!
Bad news, I'm a fuse, and I've met my match
So stand back, it's about to go off!
That vixen, she's a master of disguise!
I see danger, when I look in her eyes
She's so foxy, she could lead to my demise
So I'm running, cause I've run out of time
She’s a bombshell blonde, wired up to detonate!
I’m James Bond, live to die another day!
Bombshell blonde, high explosive dynamite!
She’s all I want so I, I’m on a mission tonight!
Her love is a drug laced with ecstasy
And her charm is spiked with a spell
A hot mess in a dress gets the best of me
She's ice cold, but she's making me melt!
That vixen, she's a master of disguise!
I see danger, when I look in her eyes
She's so foxy, she could lead to my demise
So I'm running, cause I've run out of time
She’s a bombshell blonde, wired up to detonate!
I’m James Bond, live to die another day!
Bombshell blonde, high explosive dynamite!
She’s all I want so I, I’m on a mission tonight!
That vixen, she's a master of disguise!
I see danger, when I look in her eyes
She's so foxy, she could lead to my demise
So I'm running, cause I've run out of time
She’s a bombshell blonde, wired up to detonate!
I’m James Bond, live to die another day!
Bombshell blonde, high explosive dynamite!
She’s all I want so I, I’m on a mission tonight!
That vixen, she's a master of disguise!
I see danger, when I look in her eyes
She's so foxy, she could lead to my demise
So I'm running, cause I've run out of time
She’s a bombshell blonde, wired up to detonate!
I’m James Bond, live to die another day!
Bombshell blonde, high explosive dynamite!
She’s all I want so I, I’m on a mission tonight!
I, I'm on a mission tonight!
I, I'm on a mission tonight!
I, I'm on a mission tonight!
I, I'm on a mission tonight!"
17,Butterfly Wings,https://genius.com/Owl-city-butterfly-wings-lyrics,Ocean Eyes,True,"If I was a raindrop
Would you be my thunderstorm?
It's cold so surround me
With rain clouds to keep me warm
I feel like I'm falling
So darling don't let me go
The thought is appalling but should I slip away
Into the stormy sea will you remember me?
Asleep in our warm cocoons
We dream of lovely things
We're both gonna wake up soon
So we hope that tomorrow brings
Us our butterfly wings
If I was a grain of sand
Would you be Miami Beach?
So dusty with starlight
Close your eyes and cuddle close to me
I'll try not to wake you
Or make a sound while you're dozing off
But in the night should the high tides
Sweep me away from you
Tell me again my dear will you be waiting here?
Whenever we leave the ground
And take to the sky
I'll smile as I'm gazing down
Because I've always wondered why
We won't need feathers to fly"
18,Can’t Live Without You,https://genius.com/Owl-city-cant-live-without-you-lyrics,Mobile Orchestra,True,"All the thoughts in my head spin around like a hurricane
And life leaves me so confused
When I trip and I fall I collapse like a tidal wave
So I'm crying out to You
You reached down out of nowhere
And picked my heart up off the floor
You put my life back together
And I'm not broken anymore
You're my only wish for a dream come true
And it goes like this: ""Will You come to my rescue?""
You're the only hope that I'm clinging to
And I hope you know I can't live without You
I can't live without You
I just can't live without You
When I'm hit like a hook to the jaw in a title fight
I'm down and I'm knocked out cold, you know
And with my heart broke apart like a wreck in a shallow tide
Yeah I've never felt this low
You reached down out of nowhere
And picked my heart up off the floor
You put my life back together
And I'm not broken anymore
You're my only wish for a dream come true
And it goes like this: ""Will You come to my rescue?""
You're the only hope that I'm clinging to
And I hope you know I can't live without you
I can't live without you
I just can't live without you
You're my only wish for a dream come true
And it goes like this: ""Will You come to my rescue?""
You're the only hope that I'm clinging to
And I hope you know I can't live without You
You're my only wish for a dream come true
And it goes like this: ""Will you come to my rescue?""
You're the only hope that I'm clinging to
And I hope you know I can't live without You"
20,Cave In,https://genius.com/Owl-city-cave-in-lyrics,Ocean Eyes,True,"Please take a long hard look
Through your text book cause I'm history
When I strap my helmet on I'll be long gone
'Cause I've been dying to leave
Yeah, I'll ride the range
And hide all my loose change in my bedroll
'Cause riding a dirt bike down a turnpike
Always takes its toll on me
I've had just about enough
Of quote diamonds in the rough
Because my backbone is paper thin
Get me out of this cavern or I'll cave in
If the bombs go off the sun will still be shining
Because I've heard it said that
Every mushroom cloud has a silver lining
Swallow a drop of gravel and blacktop
'Cause the road tastes like Wintergreen
The wind and the rain smell of oil and octane
Mixed with stale gasoline
I'll soak up the sound
Try to sleep on the wet ground
I'll get ten minutes give or take
'Cause I just don't foresee myself getting drowsy
When cold integrity keeps me wide awake
Get me out of this cavern or I'll cave in
Get me out of this cavern or I'll cave in
I'll keep my helmet on
Just in case my head caves in
'Cause if my thoughts collapse
Or my framework snaps
It'll make a mess like you wouldn't believe
Tie my handlebars to the stars
So I stay on track 
And if my intentions stray I'll wrench them away
Then I'll take my leave and I won't even look back
I won't even look back
(Da da da da da da da da da da
Da da da da da da da daaa...)"
26,Dementia,https://genius.com/Owl-city-dementia-lyrics,The Midsummer Station,True,"Dementia, you're driving me crazy
This is driving me crazy
Dementia, oh, dementia
Every light in the night flickered in and out
Every bone in my back shivered up and down
Keep the pace just in case all the magic dies
Cause this is driving me crazy
Every voice in my head shouted yes and no
Every freight train of thought fought to stop and go
Keep the pace just in case all the magic dies
Cause this is driving me crazy
Big surprise, I'm a ghost keeping out of sight
Rub your eyes, you're a star in a summer night
This is love, this is war, it's insanity
Dementia, you're driving me crazy
Every tear in my eyes dripped and wouldn't drop
Every disc in my spine shook and couldn't stop
Keep the pace just in case all the magic dies
Cause this is driving me crazy
Every hand let me go that I tried to hold
Every warm-hearted love left me freezing cold
Keep the pace just in case all the magic dies
Cause this is driving me crazy
Big surprise, I'm a ghost keeping out of sight
Rub your eyes, you're a star in a summer night
This is love, this is war, it's insanity
Dementia, you're driving me crazy
Big surprise, I'm a ghost keeping out of sight
Rub your eyes, you're a star in a summer night
This is love, this is war, it's insanity
Dementia, oh, dementia
Through the skies you're en route at the speed of light
So realize there's chaos in the air tonight
This is love, this is war, this is pure insanity
Dementia, you're driving me crazy
This is driving me crazy
Oh, dementia, you're driving me crazy"
27,Dental Care,https://genius.com/Owl-city-dental-care-lyrics,Ocean Eyes,True,"I brush my teeth, and look in the mirror
And laugh out loud as I'm beaming from ear to ear
I'd rather pick flowers, instead of fights
And rather than flaunt my style
I'd flash you a smile, of clean pearly whites
I've been to the dentist a thousand times so I know the drill
I smooth my hair, sit back in the chair
But somehow I still get the chills
""Have a seat"" he says pleasantly
As he shakes my hand, and practically laughs at me
""Open up nice and wide"" he says peering in
And with a smirk he says ""Don't have a fit, this'll just pinch a bit""
As he tries not to grin
When hygienists leave on long vacations
That's when dentists scream and lose their patience
Talking only brings the toothaches on
Because I say the stupidest things
So if my resolve goes South
I'll swallow my pride with an aspirin, and shut my mouth
Golf and alcohol don't mix
And that's why I don't drink and drive
Because, good grief I'd knock out my teeth
And have to kiss my smile goodbye
I've been to the dentist a thousand times so I know the drill
I smooth my hair, sit back in the chair
But somehow I still get the chills"
29,Dreams and Disasters,https://genius.com/Owl-city-dreams-and-disasters-lyrics,The Midsummer Station,True,"We were alone on the road, driving faster
So far from home, we were chasing disaster
Hard on the gas, 'til the car caught on fire
We had to laugh, as the smoke billowed higher
I want to feel alive forever after
And you say, you say you want to feel alive forever after
And I, and I, and I say
Fo-o-ollow the li-i-ight through the dreams and disasters
Fo-o-ollow the li-i-ight to the edge and the after
We won't turn around
We will not slow down
Fo-o-ollow the li-i-ight through the dreams and disasters
Think of the sun and the sound of it rising
Still on the run with our eyes on the horizon
I want to feel alive forever after
And you say, you say you want to feel alive forever after
And I, and I, and I say
Fo-o-ollow the li-i-ght through the dreams and disasters
Fo-o-ollow the li-i-ght to the edge and the after
We won't turn around
We will not slow down
Fo-o-ollow the li-i-ght through the dreams and disasters
I just want to feel alive
I just want to feel alive
I just want to feel alive
I just want to feel alive
Fo-o-ollow the li-i-ght through the dreams and disasters
Fo-o-ollow the li-i-ght to the edge and the after
We won't turn around
We will not slow down
Fo-o-ollow the li-i-ght through the dreams and disasters"
32,Embers,https://genius.com/Owl-city-embers-lyrics,The Midsummer Station,True,"There were days when each hour
Was a war I fought to survive
There were nights full of nightmares
And I dreaded closing my eyes
There were skies that burst open
With a downpour to drown me alive
But the world took a spark like a match in the dark
And the fire brought me to life
So I'm fanning the flames to climb so high
Because there's no other way we can stay alive
Because we're burning bright as we all unite
And when it's all said and done we'll shine like the sun
So don't let the fire die
And we'll watch the sky as it fills with light
And though the embers are new, whatever you do
Just don't let the fire die
And you'll find, there'll be mornings
When the ashes and embers are cold
But you'll fight with a passion
And you'll never stop cause you know
Yeah you know it gets better
And your story is yet to be told
Every push, every shove, every war, every love
Yeah the coals are beginning to glow
Don't let the fire die
It gets better
Just don't let the fire die, no
And though the embers are new, whatever you do
Just don't let the fire die
Don't let the fire die"
37,Fireflies,https://genius.com/Owl-city-fireflies-lyrics,Ocean Eyes,True,"You would not believe your eyes
If ten million fireflies
Lit up the world as I fell asleep
'Cause they'd fill the open air
And leave teardrops everywhere
You'd think me rude but I would just stand and stare
I'd like to make myself believe
That planet Earth turns slowly
It's hard to say that I'd rather stay awake when I'm asleep
'Cause everything is never as it seems
'Cause I'd get a thousand hugs
From ten thousand lightning bugs
As they tried to teach me how to dance
A foxtrot above my head
A sock hop beneath my bed
The disco ball is just hanging by a thread
I'd like to make myself believe
That planet Earth turns slowly
It's hard to say that I'd rather stay awake when I'm asleep
'Cause everything is never as it seems 
Leave my door open just a crack
'Cause I feel like such an insomniac
Why do I tire of counting sheep?
When I'm far too tired to fall asleep 
To ten million fireflies
I'm weird 'cause I hate goodbyes
I got misty eyes as they said farewell 
But I'll know where several are
If my dreams get real bizarre
'Cause I saved a few and I keep them in a jar 
]
I'd like to make myself believe
That planet Earth turns slowly
It's hard to say that I'd rather stay awake when I'm asleep
'Cause everything is never as it seems 
I'd like to make myself believe
That planet Earth turns slowly
It's hard to say that I'd rather stay awake when I'm asleep
'Cause everything is never as it seems 
I'd like to make myself believe
That planet Earth turns slowly
It's hard to say that I'd rather stay awake when I'm asleep
Because my dreams are bursting at the seams"
38,Fireflies (Adam Young Remix),https://genius.com/Owl-city-fireflies-adam-young-remix-lyrics,Ocean Eyes,True,"You would not believe your eyes
If ten million fireflies
Lit up the world as I fell asleep
'Cause they'd fill the open air
And leave teardrops everywhere
You'd think me rude, but I would just stand and stare
'Cause I'd get a thousand hugs
From ten thousand lightning bugs
As they try to teach me how to dance
A foxtrot above my head
A sock hop beneath my bed
A disco ball is just hanging by a thread
I'd like to make myself believe
That planet Earth turns slowly
It's hard to say that I'd rather stay awake when I'm asleep
'Cause everything is never as it seems
Leave my door open just a crack
'Cause I feel like such an insomniac
Why do I tire of counting sheep?
When I'm far too tired to fall asleep
To ten million fireflies
I'm weird 'cause I hate goodbyes
I got misty eyes as they said farewell
But I'll know where several are
If my dreams get real bizarre
'Cause I saved a few and I keep them in a jar
]
I'd like to make myself believe 
That planet Earth turns slowly
It's hard to say that I'd rather stay awake when I'm asleep
'Cause everything is never as it seems
I'd like to make myself believe
That planet Earth turns slowly
It's hard to say that I'd rather stay awake when I'm asleep
Because my dreams are bursting at the seams"
43,Gold,https://genius.com/Owl-city-gold-lyrics,The Midsummer Station,True,"Stand on up and take a bow
There's something there and it's showing
There's no need to look around
You're the best we got going
Shout out to the dreams you'll chase
Shout out to the hearts you'll break
Nothing's gonna stop you now
I guess you'd better be going
You'll never be far, I'm keeping you near
Inside of my heart, you're here
Go on
It's gotta be time
You're starting to shine
'Cause what you've got is
Go-o-o-o o-o o-o-old
I know you're gold
O-o-o-o o-o o-oh oh
I know I know
I don't need the stars in the night
I've found my treasure
All I need is you by my side
So shine forever
Go-o-o-o-o-o-o-o-old
I know you're gold
O-o-o-o o-o o-oh oh
I know you're gold
It won't take you long to get
When you feel like you're soaring
So write it all and don't forget
You gotta tell us your story
Shout out to the friends back home
Shout out to the hearts you've known
You gave 'em nothing but the best, yeah
And you can tell 'em your story
You'll never be far, I'm keeping you near
Inside of my heart, you're here
Go on
It's gotta be time
You're starting to shine
'Cause what you've got is
Go-o-o-o o-o o-o-old
I know you're gold
O-o-o-o o-o o-oh oh
I know I know
I don't need the stars in the night
I've found my treasure
All I need is you by my side
So shine forever
Go-o-o-o-o-o-o-o-old
I know you're gold
O-o-o-o o-o o-oh oh
I know you're gold
'Cause what you have got is
Go-o-o-o o-o o-o-old
I know you're gold
O-o-o-o o-o o-oh oh
I know I know
I don't need stars in the night
I've found my treasure
All I need is you by my side
So shine forever
Go-o-o-o-o-o-o-o-old
I know you're gold
O-o-o-o o-o o-oh oh
I know you're gold
You're gold
You're gold"
46,Hello Seattle (Ocean Eyes Version),https://genius.com/Owl-city-hello-seattle-ocean-eyes-version-lyrics,Ocean Eyes,True,"Hello Seattle, I am a mountaineer
In the hills and highlands
I fall asleep in hospital parking lots
And awake in your mouth
Hello Seattle, I am a manta ray
Deep beneath the blue waves
I'll crawl the sandy bottom of Puget Sound
And construct a summer home
Hello Seattle, I am the crescent moon
Shining down on your face
I will disguise myself as a sleeping pill
And descend inside of you
Hello Seattle, I am a cold seahorse
Feeling warm in your sand
I sing about the tide and the ocean surf
Rolling in the evening breeze
Hello Seattle, I am an albatross
On the docks and moored boats
I sail above your inlets and interstates
Through the rain and open wind
Hello Seattle, I am an old lighthouse
Throwing beams of bright light
Red in the morning, blue in the evening sun
Taking heed for everyone
Hello Seattle, I am a mountaineer
In the hills and highlands
I fall asleep in hospital parking lots
Take me above your light
Carry me through the night
Hold me secure in flight
Sing me to sleep tonight
Take me above your light 
Carry me though the night 
Hold me secure in flight 
Sing me to sleep tonight "
48,Hello Seattle (Remix),https://genius.com/Owl-city-hello-seattle-remix-lyrics,Ocean Eyes,True,"Hello Seattle, I am a mountaineer
In the hills and highlands
I fall asleep in hospital parking lots
And awake in your mouth
Hello Seattle, I am a manta ray
Deep beneath the blue waves
I'll crawl the sandy bottom of Puget Sound
And construct a summer home
Hello Seattle, I am the crescent moon
Shining down on your face
I will disguise myself as a sleeping pill
And descend inside of you
Hello Seattle, I am a cold seahorse
Feeling warm in your sand
I sing about the tide and the ocean surf
Rolling in the evening breeze
Hello Seattle, I am an albatross
On the docks and moored boats
I sail above your inlets and interstates
Through the rain and open wind
Hello Seattle, I am an old lighthouse
Throwing beams of bright light
Red in the morning, blue in the evening sun
Taking heed for everyone
Take me above your light
Carry me through the night
Hold me secure in flight
Sing me to sleep tonight
Take me above your light 
Carry me through the night 
Hold me secure in flight 
Sing me to sleep tonight "
50,Hey Anna,https://genius.com/Owl-city-hey-anna-lyrics,The Midsummer Station,True,"Hey Anna, he’s just a boy you won’t understand if you try
So, hey Anna, smile when he’s holding your hand tonight
Hey Anna, remember when you’re wishing away your life
Hey, hey Anna, everything is going to turn out just fine
Da-da-da, da-da-da, da-da-whoa-oh
Such a hot crush
Makes your face blush
But try to take your time
Because every goose chase
Makes your heart race
And then you wonder why?
So wait for the home run
You’ll find the right one
And you’ll figure this all out
Life is a mind game
Love is a blind date
And it’s making your heart pound
Waking up sad
Isn’t so bad
If you look outside
Because all the signs say
That it’s a new day
And you were so alive
Life is a mind game
Love is a blind date
And it’s making your heart pound
 "
55,Hot Air Balloon,https://genius.com/Owl-city-hot-air-balloon-lyrics,Ocean Eyes,True,"We wrote a prelude, to our own fairytale
And bought a parachute, at a church rummage sale
And with a mean sewing machine and miles of thread
We sewed the day above L.A., in navy and red
We wound a racetrack, through your mom's kitchen chairs
And fought the shadows back, down your dark basement stairs
I lit a match and let it catch, to light up the room
And then you yelled as we beheld
An old maroon hot air balloon
I'll be out of my mind
And you'll be out of ideas pretty soon
So let's spend the afternoon
In a cold hot air balloon
Leave your jacket behind
Lean out and touch the tree tops over town
I can't wait to kiss the ground wherever we touch back down
La la la la la la
La la la la la la
We drank the great lakes
Like cold lemonade
And both got stomach aches
Sprawled out in the shade
So bored to death, you held your breath
And I tried not to yawn
You make my frown turn upside down
And now my worries are gone
I'll be out of my mind
And you'll be out of ideas pretty soon
So let's spend the afternoon
In a cold hot air balloon
Leave your jacket behind
Lean out and touch the tree tops over town
I can't wait to kiss the ground wherever we touch back down
I'll be out of my mind
And you'll be out of ideas pretty soon
So let's spend the afternoon
In a cold hot air balloon
Leave your jacket behind
Lean out and touch the tree tops over town
I can't wait to kiss the ground wherever we touch back down"
61,If My Heart Was A House,https://genius.com/Owl-city-if-my-heart-was-a-house-lyrics,Ocean Eyes,True,"You're the sky that I fell through
And I remember the view whenever I'm holding you
The sun hung from a string
Looking down on the world as it warms over everything
Chills run down my spine as our fingers entwine
And your sighs harmonize with mine
Unmistakably, I can still feel your heart
Beat fast when you dance with me
We got older and I should've known
That I'd feel colder when I walk alone
So I may as well ditch my dismay
Bombs away
Bombs away
Circle me and the needle moves gracefully back and forth
If my heart was a compass, you'd be north
Risk it all 'cause I'll catch you if you fall
Wherever you go, if my heart was a house, you'd be home
It makes me smile because you said it best
I would clearly feel blessed if the sun rose up from the West
Flower balm perfume, all my clothes smell like you
'Cause your favorite shade is navy blue
I walk slowly when I'm on my own
Yeah, but frankly I still feel alone
So I may as well ditch my dismay
Bombs away
Bombs away
Circle me and the needle moves gracefully back and forth
If my heart was a compass, you'd be north
Risk it all '​cause I'll catch you if you fall
Wherever you go, if my heart was a house, you'd be home
If my heart was a house, you'd be home"
